title,detail_title,job_url,company,company_name_full,company_url,company_url_from_job,salary_list,detail_salary,address_list,detail_location,exp_list,detail_experience,deadline,tags,job_level,education_level,job_quantity,employment_type,working_addresses,working_times,desc_mota,desc_yeucau,desc_quyenloi,company_website,company_scale,company_field,company_address,company_description
CTV Phát Triển Dữ Liệu - TA188,CTV Phát Triển Dữ Liệu - TA188,https://www.topcv.vn/brand/vpbank/tuyen-dung/ctv-phat-trien-du-lieu-ta188-j2056153.html?ta_source=JobSearchList_LinkDetail&u_sr_id=6oOcfChhJDdb5S1Ecdgd4AGKjb5PyMwrgRoWbeLA_1772869020,Ngân Hàng TMCP Việt Nam Thịnh Vượng (VPBank),Ngân Hàng TMCP Việt Nam Thịnh Vượng (VPBank) - Chuyên trang tuyển dụng,https://www.topcv.vn/brand/vpbank?id=493,https://www.topcv.vn/brand/vpbank?id=493,Thoả thuận,Thoả thuận,Hà Nội,,Dưới 1 năm,Dưới 1 năm,Còn 27 ngày để ứng tuyển,Chuyên môn Data Analyst,Trưởng nhóm,Đại Học trở lên,1 người,Toàn thời gian,"Tòa nhà VPBank, 89 Láng Hạ, Phường Đống Đa (quận Đống Đa cũ)",Thứ 2 - Thứ 6 (từ 08:00 đến 17:00) từ thứ 2 – thứ 6 & 2 sáng thứ 7/tháng; Thứ 2 - Thứ 6 (từ 08:00 đến 17:00); từ thứ 2 – thứ 6 & 2 sáng thứ 7/tháng,"Tham gia quản lý dữ liệu và phát triển hệ thống cho hệ thống kho dữ liệu DWH toàn hàng, nền tảng dịch vụ quản trị và phân tích dữ liệu của VPbank và Ecosystem. Tham gia quản lý BAU và xây dựng, triển khai các dự án và sáng kiến chiến lược liên quan. Đảm bảo các hệ thống dữ liệu và báo cáo nêu trên được phát triển một cách hiệu quả, bền vững và đáp ứng được yêu cầu của người sử dụng một cách tối ưu nhất.
Tiếp nhận và phân tích yêu cầu dữ liệu từ các đơn vị theo từng CR nhằm đáp ứng yêu cầu nghiệp vụ. Tham gia xuyên suốt vào quá trình phát triển, kiểm thử chất lượng
Quản lý yêu cầu và timeline các yêu cầu CR cho hệ thống DWH
Tham gia các hoạt động nghiên cứu giải pháp, công nghệ mới liên quan tới Quản lý dữ liệu. Triển khai các sáng kiến chiến lược trên nền tảng công nghệ mới phục vụ cho việc duy trì ổn định và nâng cao dịch vụ thiết kế và quản lý dữ liệu
Tham gia golive các yêu cầu thay đổi hệ thống
Tổ chức liên tục cải tiến tối ưu về mặt thiết kế, góp phần làm giảm thời gian xử lý dữ liệu cũng như tài nguyên sử dụng trên các hệ thống dữ liệu
Thực hiện các công việc khác do cấp trên giao phó
Tham gia quản lý dữ liệu và phát triển hệ thống cho hệ thống kho dữ liệu DWH toàn hàng, nền tảng dịch vụ quản trị và phân tích dữ liệu của VPbank và Ecosystem. Tham gia quản lý BAU và xây dựng, triển khai các dự án và sáng kiến chiến lược liên quan. Đảm bảo các hệ thống dữ liệu và báo cáo nêu trên được phát triển một cách hiệu quả, bền vững và đáp ứng được yêu cầu của người sử dụng một cách tối ưu nhất.
Tiếp nhận và phân tích yêu cầu dữ liệu từ các đơn vị theo từng CR nhằm đáp ứng yêu cầu nghiệp vụ. Tham gia xuyên suốt vào quá trình phát triển, kiểm thử chất lượng
Quản lý yêu cầu và timeline các yêu cầu CR cho hệ thống DWH
Tham gia các hoạt động nghiên cứu giải pháp, công nghệ mới liên quan tới Quản lý dữ liệu. Triển khai các sáng kiến chiến lược trên nền tảng công nghệ mới phục vụ cho việc duy trì ổn định và nâng cao dịch vụ thiết kế và quản lý dữ liệu
Tham gia golive các yêu cầu thay đổi hệ thống
Tổ chức liên tục cải tiến tối ưu về mặt thiết kế, góp phần làm giảm thời gian xử lý dữ liệu cũng như tài nguyên sử dụng trên các hệ thống dữ liệu
Thực hiện các công việc khác do cấp trên giao phó","Tốt nghiệp 1 trong các ngành kinh tế, tài chính, ngân hàng, hoặc công nghệ thông tin, khoa học máy tính, toán tin ứng dụng,...
Có khả năng đi làm full-time
Năng lực nghiên cứu, học hỏi liên tục và thực hành công nghệ mới
Sử dụng tốt công cụ MSoffice, ưu tiên có hiểu biết về các công cụ xử lý dữ liệu (SQL,..)
Hiểu biết cơ sở dữ liệu quan hệ RDBMS, NoSQL: Oracle, MS SQL Server, Redshift, IBM DB2, ...
Hiểu biết thiết kế lập trình cho các hệ thống như hệ thống Data warehouse, Data lake, lakehouse, API, CI/CD. ETL, ELT, ...
Có kinh nghiêm với các dịch vụ xử lý dữ liệu và luồng dữ liệu dạng batch/stream, quản lý luồng vận  hành là lợi thế: SSIS, Datastage, ODI, Spark, Nifi, Airflow, DBT, v.v...
Có kinh nghiệm với ít nhất 1 trong các BI Tool là lợi thế
Tốt nghiệp 1 trong các ngành kinh tế, tài chính, ngân hàng, hoặc công nghệ thông tin, khoa học máy tính, toán tin ứng dụng,...
Có khả năng đi làm full-time
Năng lực nghiên cứu, học hỏi liên tục và thực hành công nghệ mới
Sử dụng tốt công cụ MSoffice, ưu tiên có hiểu biết về các công cụ xử lý dữ liệu (SQL,..)
Hiểu biết cơ sở dữ liệu quan hệ RDBMS, NoSQL: Oracle, MS SQL Server, Redshift, IBM DB2, ...
Hiểu biết thiết kế lập trình cho các hệ thống như hệ thống Data warehouse, Data lake, lakehouse, API, CI/CD. ETL, ELT, ...
Có kinh nghiêm với các dịch vụ xử lý dữ liệu và luồng dữ liệu dạng batch/stream, quản lý luồng vận  hành là lợi thế: SSIS, Datastage, ODI, Spark, Nifi, Airflow, DBT, v.v...
Có kinh nghiệm với ít nhất 1 trong các BI Tool là lợi thế","Có chính sách hỗ trợ lương
Được học hỏi kinh nghiệm từ Anh/Chị
Có cơ hội trở thành nhân viên chính thức sau thời gian cộng tác
Được làm việc trong môi trường ngân hàng chuyên nghiệp
Làm quen với các hệ thống và quy trình tiên tiến.
Môi trường làm việc năng động, thân thiện, có nhiều cơ hội học đào tạo, học hỏi và phát triển; được tham gia nhiều hoạt động văn hóa thú vị (cuộc thi về thể thao, tài năng, hoạt động teambuiding...)
Được tham gia các khóa đào tạo tùy thuộc vào Khung đào tạo cho từng vị trí
Thời gian làm việc: từ thứ 2 – thứ 6 & 02 sáng thứ 7/ tháng
Có chính sách hỗ trợ lương
Được học hỏi kinh nghiệm từ Anh/Chị
Có cơ hội trở thành nhân viên chính thức sau thời gian cộng tác
Được làm việc trong môi trường ngân hàng chuyên nghiệp
Làm quen với các hệ thống và quy trình tiên tiến.
Môi trường làm việc năng động, thân thiện, có nhiều cơ hội học đào tạo, học hỏi và phát triển; được tham gia nhiều hoạt động văn hóa thú vị (cuộc thi về thể thao, tài năng, hoạt động teambuiding...)
Được tham gia các khóa đào tạo tùy thuộc vào Khung đào tạo cho từng vị trí
Thời gian làm việc: từ thứ 2 – thứ 6 & 02 sáng thứ 7/ tháng",,,,,
Data Analyst,Data Analyst,https://www.topcv.vn/viec-lam/data-analyst/1985499.html?ta_source=JobSearchList_LinkDetail&u_sr_id=6oOcfChhJDdb5S1Ecdgd4AGKjb5PyMwrgRoWbeLA_1772869020,CÔNG TY TNHH KRIK VIỆT NAM,CÔNG TY TNHH KRIK VIỆT NAM,https://www.topcv.vn/cong-ty/cong-ty-tnhh-krik-viet-nam/160722.html,https://www.topcv.vn/cong-ty/cong-ty-tnhh-krik-viet-nam/160722.html,Tới 20 triệu,Tới 20 triệu,Hà Nội,Hà Nội,Không yêu cầu,Không yêu cầu,02/04/2026,Data Analyst,Quản lý / Giám sát,Cao Đẳng trở lên,1 người,Toàn thời gian,"- Hà Nội: 82 Dịch Vọng Hậu, Cầu Giấy, Phường Cầu Giấy (quận Cầu Giấy cũ)",Thứ 7 (từ 08:00 đến 17:00); Thứ 2 - Thứ 6 (từ 08:00 đến 17:00); Được nghỉ 2 thứ 7 và các chủ nhật trên 1 tháng,"- Thiết kế và xây dựng hệ thống báo cáo cho các phòng ban: Kinh doanh, Kế toán, Sản phẩm, Marketing
- Xây dựng báo cáo ngày; tuần; tháng; quý phục vụ BOD.
- Phối hợp với trưởng phòng ban để xác định nhu cầu dữ liệu và tiêu chuẩn hóa chỉ số.
- Thiết kế dashboard trực quan bằng: Power BI hoặc Looker
Phân tích chuyên sâu & Insight
- Phân tích hiệu quả kinh doanh theo sản phẩm; cửa hàng; chiến dịch; thời gian.
- Phân tích xu hướng; bất thường; rủi ro vận hành.
- Đề xuất giải pháp tối ưu dựa trên dữ liệu (giảm tồn kho; tăng hiệu suất; tối ưu chi phí marketing…).","Sử dụng thành thạo ngôn ngữ truy vấn dữ liệu Microsoft SQL.
Có kinh nghiệm làm việc với Python trong xử lý và phân tích dữ liệu (ưu tiên).
Có kinh nghiệm sử dụng các công cụ phân tích và trực quan hóa dữ liệu như SQL, Tableau, Power BI hoặc các công cụ tương đương.
Phân tích số liệu và xây dựng các đề xuất dựa trên kết quả phân tích.
Có khả năng tư duy phân tích để xác định vấn đề và đề xuất hướng xử lý dựa trên dữ liệu.","Review 6 tháng 1 lần
Thời gian làm việc: T2- T6 và T7 (nghỉ 02 buổi T7/ tháng)
Môi trường làm việc trẻ trung, năng động, thân thiện
Tham gia (BHYT, BHXH, BHTN) và các chế độ phúc lợi theo nội quy, quy chế của Công ty (tham quan, nghỉ mát, lương thưởng, nghỉ Tết lễ ...)",https://krik.vn/,100-499 nhân viên,Thời trang,"Số 344 Cầu Giấy , Phường Dịch Vọng, Quận Cầu Giấy, Thành phố Hà Nội, Việt Nam","KRIK là thương hiệu thời trang nam dành cho giới trẻ được thành lập từ năm 2013. Trải qua quá trình hình thành và phát triển KRIK , không ngừng lớn mạnh, đến nay hệ thống đã có 8 cửa hàng ở các tuyến phố thời trang lớn như Cầu Giấy, Chùa Bộc, Nguyến Trãi... Với hơn 100 nhân sự đang làm việc, KRIK mong muốn tìm kiếm và phát triển nhân tài để hướng tới mục tiêu mở rộng thị phần nhanh chóng tại Việt Nam. Tại KRIK chúng tôi mong muốn xây dựng văn hoá làm việc dựa trên tinh thần nhiệt huyết, luôn sẵn sàng đảm nhận nhiệm vụ mới và cam kết thực hiện những mục tiêu đã đề ra. Xem thêm Thu gọn"
Chuyên Viên Phân Tích Dữ Liệu - Data Analyst (ERP),Chuyên Viên Phân Tích Dữ Liệu - Data Analyst ( ERP ),https://www.topcv.vn/viec-lam/chuyen-vien-phan-tich-du-lieu-data-analyst-erp/1963604.html?ta_source=JobSearchList_LinkDetail&u_sr_id=6oOcfChhJDdb5S1Ecdgd4AGKjb5PyMwrgRoWbeLA_1772869020,CÔNG TY CỔ PHẦN TẬP ĐOÀN TÂN THÀNH ĐÔ,CÔNG TY CỔ PHẦN TẬP ĐOÀN TÂN THÀNH ĐÔ,https://www.topcv.vn/cong-ty/cong-ty-co-phan-tap-doan-tan-thanh-do/147323.html,https://www.topcv.vn/cong-ty/cong-ty-co-phan-tap-doan-tan-thanh-do/147323.html,16 - 18 triệu,16 - 18 triệu,Hồ Chí Minh (mới),Hồ Chí Minh,2 năm,2 năm,04/04/2026,Data Analyst,Trưởng nhóm,Đại Học trở lên,1 người,Toàn thời gian,"- Hồ Chí Minh: DVTM-08 và Lô DVTM-11, Đường số 7, Khu chế xuất Tân Thuận, Phường Tân Thuận (Quận 7 cũ)",Thứ 2 - Thứ 6 (từ 08:00 đến 17:00),"Mô tả công việc:
Phân tích, thiết kế, xây dựng các mô hình dữ liệu và truy vấn trực quan hóa dữ liệu bằng công cụ Power BI/ Tableau.
Chịu trách nhiệm quản lý nguồn dữ liệu và hệ thống báo cáo phân dữ liệu trực quan của Tập đoàn và Công ty thành viên.
Tham gia các dự án phát triển hệ thống ứng dụng/website/mobile cho Tập đoàn và các Công ty thành viên.
Tham gia các dự án triển khai phần mềm với đối tác như: ERP, HRM, CRM, … theo định hướng của Tập đoàn.
Tham gia xây dựng hệ thống Cơ sở dữ liệu Datawarehouse cho Tập đoàn.
Báo cáo công việc và tiến độ cho cấp trên trực tiếp.
Địa điểm làm việc:
Tòa nhà Newcity, 216-218 Quốc Lộ 13, Phường Hiệp Bình, TP.HCM / Dự kiến sẽ dời VP về Phường Tân Thuận, TP.HCM vào đầu năm 2026.","Kinh nghiệm:
Từ 02 năm trở lên.
Chuyên môn:
Tốt nghiệp Đại học chuyên ngành CNTT/ Hệ thống thông tin Quản lý/ Kiến trúc máy tính.
Có kinh nghiệm thực tế phân tích, thiết kế hệ thống phần mềm hướng đối tượng/ hướng dịch vụ (OOPs/ Microservices).
Có kinh nghiệm thực tế về các ngôn ngữ truy vấn dữ liệu trên các Hệ quản trị cơ sở dữ liệu Relationship/ Non-Relationship (MS SQL Server, Oracle, MySQL,…).
Thành thạo các công cụ phân tích, trích xuất dữ liệu báo cáo BI như Power BI, Tableau,…
Có kinh nghiệm về lập trình ứng dụng Window App, Web App, Mobile App.
Có kinh nghiệm thực tế với các ngôn ngữ & kỹ thuật lập trình: C#, Python, Javascript, React, React Native, HTML, Web Services, Restful API, .NET Core,…
Có kiến thức về các nền tảng Cloud Service: Google Clould Service, AWS, Microsoft 365 (Azure, Sharepoint, Power Platforms).
Có kiến thức về Data Model, ETL,… trong việc xây dựng Datawarehouse.
Có kiến thức về việc áp dụng các Mô hình/ Công cụ AI vào thực tế.
Quen thuộc với các công cụ quản lý và phát triển phần mềm theo SDLC, Jira, Git,…
Có kinh nghiệm tham gia dự án phần mềm theo mô hình Agile, Predictive, Adaptive.
Tiếng Anh (Đọc & Viết tốt).
Yêu cầu khác:
Ưu tiên ứng viên đã có các chứng chỉ liên quan như Microsoft Certified, Data Analyst Associate, Power BI Administrator Associate.
Kỹ năng làm việc nhóm hiệu quả, giải quyết vấn đề, tư duy mở, năng động, sáng tạo, giao tiếp tốt.
Khả năng nghiên cứu, học hỏi công nghệ nhanh và cẩn thận trong công việc.
Kỷ luật, có tư duy kiểm soát rủi ro và quản lý dự án. Không đồng ý nhưng cam kết thực thi vì mục tiêu chung.
Sẵn sàng đi lại khi cần thiết (triển khai các dự án).","Phụ cấp cơm trưa: 30.000 VNĐ/ngày.
Bảo hiểm xã hội, bảo hiểm sức khỏe cá nhân PVI, khám sức khỏe định kỳ hàng năm.
Thưởng Lễ, Tết, Sinh nhật, Lương tháng 13.
Môi trường làm việc chuyên nghiệp, thân thiện, hỗ trợ phát triển cá nhân.
Cơ hội đào tạo, nâng cao nghiệp vụ, kỹ năng mềm và kỹ năng chuyên môn.",,25-99 nhân viên,Khác,"232 Trần Hưng Đạo, P. Nguyễn Cư Trinh, Quận 1, Tp. HCM",Chưa có thông tin công ty
Business Data Analyst,Business Data Analyst,https://www.topcv.vn/viec-lam/business-data-analyst/1480832.html?ta_source=JobSearchList_LinkDetail&u_sr_id=6oOcfChhJDdb5S1Ecdgd4AGKjb5PyMwrgRoWbeLA_1772869020,TẬP ĐOÀN CÔNG NGHIỆP - VIỄN THÔNG QUÂN ĐỘI,TẬP ĐOÀN CÔNG NGHIỆP - VIỄN THÔNG QUÂN ĐỘI,https://www.topcv.vn/cong-ty/tap-doan-cong-nghiep-vien-thong-quan-doi/128588.html,https://www.topcv.vn/cong-ty/tap-doan-cong-nghiep-vien-thong-quan-doi/128588.html,Thoả thuận,Thoả thuận,Hà Nội,Hà Nội,Không yêu cầu,Không yêu cầu,30/04/2026,Business Analyst (Phân tích nghiệp vụ),Trưởng nhóm,Đại Học trở lên,3 người,Toàn thời gian,"- Hà Nội: Tòa Keangnam Landmark 72, Phạm Hùng, Phường Từ Liêm (quận Nam Từ Liêm cũ)",Thứ 2 - Thứ 6 (từ 08:00 đến 17:30),"Làm việc với các đơn vị có nhu cầu để khảo sát, phân tích và nhận diện và hiểu rõ vấn đề/cơ hội để xây dựng các hệ thống hỗ trợ ra quyết định dựa trên dữ liệu như hệ thống Data Lake, Data Warehouse, hệ thống BI tại các đơn vị.
Phối hợp với các bên liên quan để phân tích và làm rõ bài toán, xác định phạm vi, mục tiêu bài toán, mô hình hóa nghiệp vụ
Cung cấp giải pháp luồng nghiệp vụ, phối hợp với đội kỹ thuật đánh giá tính khả thi giải pháp
Viết các tài liệu phân tích nghiệp vụ, thiết kế giao diện mẫu (prototype)
Truyền tải và hỗ trợ các thành viên dự án hiểu và làm đúng theo yêu cầu khách hàng.
Tổ chức hướng dẫn, hỗ trợ đào tạo người dùng sử dụng sản phẩm và quản lý được vấn đề của khách hàng về sản phẩm.
Chốt thống nhất với khách hàng về yêu cầu bài toán.
Quản lý và lưu trữ các yêu cầu thay đổi theo đúng quy trình.","Tốt nghiệp đại học loại Khá trở lên, ưu tiên chuyên ngành Công nghệ thông tin, Kỹ sư phần mềm. Đặc biệt ưu tiên các trường Học viện Công nghệ Bưu chính Viễn thông, Đại học Bách khoa Hà Nội,...
Tiếng Anh tương đương 650+ TOEIC trở lên
Có kiến thức nền tảng CNTT và am hiểu quy trình phát triển phần mềm
Kỹ năng điều phối và khảo sát bài toán
Kỹ năng phân tích và mô hình nghiệp vụ: UML, Use Case, BPMN
Kỹ năng và kiến thức phân tích thiết kế phần mềm: ERD, Activity Diagram, DFD của hệ thống..
Có kiến thức UX (Hiểu được những khái niệm chính và phương pháp, Cách tiếp cận hướng UX trong dự án, có thể đứng ở vai trò người dùng để trải nghiệm sản phẩm)
Thành tạo ít nhất một công cụ thiết kế prototype như figma, Axure, Balsamiq...
Kỹ năng sử dụng ngôn ngữ SQL
Kiến thức về các loại CSDL (RDBMS, NoSQL, ...)
Kiến thức về xử lý dữ liệu phân tán, xử lý dữ liệu lớn (Hadoop, Spark)
Kỹ năng giao tiếp, thuyết trình, trình bày vấn đề trực quan, ngắn gọn, hiệu quả","Thời gian làm việc: 8h00 - 17h30 từ thứ 2 tới thứ 6
Địa điểm làm việc: Làm việc tại tòa nhà văn phòng hạng A cao nhất Thủ đô - Keangnam Landmark 72, Phạm Hùng, Nam Từ Liêm, Hà Nội
Mức lương thu hút và cạnh tranh, ứng viên thỏa thuận khi tham gia phỏng vấn
Chính sách thưởng hấp dẫn: thưởng năm, ngày lễ Tết, ... theo quy định chung của Tập đoàn Viettel
Đóng BHXH, BHYT, BHTN theo quy định Nhà nước; khám sức khỏe định kỳ hàng năm
Cơ hội tiếp xúc với các dự án lớn, mới mẻ & tham gia xây dựng những sản phẩm lớn và có chỗ đứng trên thị trường Fintech Việt Nam
Cơ hội thăng tiến rõ ràng với nhiều cấp bậc
Cơ hội ứng tuyển thử sức đi học tập và làm việc tại nước ngoài theo các khóa ngắn hạn, dài hạn
Công việc luôn thay đổi, thách thức, không thỏa hiệp với sự lỗi thời.
Lãnh đạo trẻ trung, biết lắng nghe và sẵn sàng tạo cơ hội để cá nhân phát triển bản thân. Đồng nghiệp thân thiện và nhiệt tình.
Nghỉ dưỡng 3 ngày nguyên lương trong năm, hỗ trợ nghỉ dưỡng lên đến 9 triệu/ người
Tham gia các hoạt động thể thao văn hóa, team building, Ngày hội Sáng tạo, giải bóng đá, Viettel’s Got Talent, event quý, event năm, event ngày nghỉ lễ tết,...
Được thư giãn, khơi nguồn sáng tạo với Happy Time mỗi ngày
Thưởng thức bữa trưa được phục vụ ngay tại VDS, được chọn lọc bởi các chuyên gia dinh dưỡng.",,5000+ nhân viên,Viễn thông,"Lô D26 khu đô thị mới Cầu Giấy, phường Yên Hoà, quận Cầu Giấy, thành phố Hà Nội, Việt Nam.","Tập đoàn Viễn thông Quân đội Viettel - giữ vững vị thế Nơi làm việc tốt nhất Việt Nam trong 06 năm liên tiếp trong ngành Viễn thông, Hạ tầng, IT (theo khảo sát Anphabe) là nhà cung cấp dịch vụ số toàn cầu, luôn đi đầu trong đổi mới sáng tạo và luôn lắng nghe, thấu hiểu để đem tới những dịch vụ tốt nhất cho khách hàng. Viettel hiện là tập đoàn công nghệ hàng đầu Việt Nam, top 18 công ty viễn thông toàn cầu với gần 70.000 nhân viên và hoạt động tại 11 thị trường trải dài từ Châu Á, Châu Mỹ, Châu Phi. Bên cạnh viễn thông, Viettel còn tham gia vào lĩnh vực nghiên cứu sản xuất công nghệ cao, phát triển ứng dụng công nghệ số, hàng không vũ trụ và nhiều lĩnh vực khác. Viettel quy tụ những tài năng hàng đầu trong mọi lĩnh vực để không ngừng sáng tạo, khám phá, đưa ra những ý tưởng giúp phát triển hệ sinh thái sản phẩm – dịch vụ Viettel. Chúng tôi tôn vinh những giá trị khác biệt và bản sắc riêng của mỗi cá nhân, cùng sự gắn kết tương quan của những nét riêng ấy trong cộng đồng và tập thể. Viettel ủng hộ sự đa dạng và hòa hợp trên tinh thần công nhận, khuyến khích và thúc đây tư duy khác biệt để phát triển nhân tài. Tập đoàn Công nghiệp Viễn thông Quân đội (Viettel) - Nơi làm việc tốt nhất Việt Nam trong 6 năm liên tiếp trong ngành Viễn thông, Hạ tầng, IT (theo khảo sát Anphabe) là nhà cung cấp dịch vụ viễn thông và dịch vụ số toàn cầu, với hơn 50.000 nhân viên và hoạt động tại 11 quốc gia trải dài từ Châu Á, Châu Mỹ, Châu Phi. Là tập đoàn có thương hiệu giá trị nhất Việt Nam, Viettel giữ vững tinh thần đi đầu trong đổi mới sáng tạo và luôn lắng nghe, thấu hiểu để đem tới những dịch vụ tốt nhất cho khách hàng, quy tụ những tài năng hàng đầu trong mọi lĩnh vực để không ngừng sáng tạo, khám phá, đưa ra những ý tưởng giúp phát triển hệ sinh thái sản phẩm – dịch vụ Viettel. Sau hơn 3 thập kỷ nỗ lực hoàn thành mục tiêu phổ cập dịch vụ viễn thông, đưa viễn thông và công nghệ thông tin vào mọi lĩnh vực của cuộc sống ở Việt Nam, Tập đoàn Công nghiệp - Viễn thông Quân đội (Viettel) đặt ra khát vọng trở thành Tập đoàn công nghiệp và công nghệ vươn tầm thế giới. Ở bất cứ giai đoạn nào trên hành trình ấy, lời hứa “sáng tạo vì con người” vẫn còn mãi. Xem thêm Thu gọn"
