title,detail_title,job_url,company,company_name_full,company_url,company_url_from_job,salary_list,detail_salary,address_list,detail_location,exp_list,detail_experience,deadline,tags,job_level,education_level,job_quantity,employment_type,working_addresses,working_times,desc_mota,desc_yeucau,desc_quyenloi,company_website,company_scale,company_field,company_address,company_description
Nhân Viên Nhân Sự (Hệ Thống Báo Cáo),Nhân Viên Nhân Sự (Hệ Thống Báo Cáo),https://www.topcv.vn/viec-lam/nhan-vien-nhan-su-he-thong-bao-cao/1866501.html?ta_source=JobSearchList_LinkDetail&u_sr_id=6oOcfChhJDdb5S1Ecdgd4AGKjb5PyMwrgRoWbeLA_1772869465,Edufit,Edufit,https://www.topcv.vn/cong-ty/edufit/18476.html,https://www.topcv.vn/cong-ty/edufit/18476.html,15 - 17 triệu,15 - 17 triệu,Hà Nội,Hà Nội,2 năm,2 năm,27/03/2026,Data Analyst; Tài chính; Kế toán; IT - Phần mềm,Nhân viên,Đại Học trở lên,1 người,Toàn thời gian,"- Hà Nội: Lô H3-LC Khu ĐTM Tây Hồ Tây, Phường Xuân Tảo, Quận Bắc Từ Liêm, Phường Từ Liêm (quận Nam Từ Liêm cũ)",Thứ 2 - Thứ 6 (từ 08:00 đến 17:00),"- Xây dựng và chuẩn hóa các bảng biểu tính toán của Khối Nhân sự
- Xây dựng các Báo cáo trong Khối nhân sự
- Đề xuất và xây dựng các công cụ nhằm gia tăng năng suất cho các hoạt động vận hành thuộc Khối nhân sự
- Tổng hợp kết quả và đưa ra cải tiến nếu có
- Thực hiện các công việc khác theo yêu cầu.","- Ưu tiên Nam; Tốt nghiệp Đại học chuyên ngành Quản trị nhân lực, Kế toán/Tài chính hoặc Công nghệ thông tin.
-
Kỹ năng
:
Thành thạo tin học các hàm nâng cao (index, query, importrange, filter, map, bycol/byrow, reduce, scan,…).
Có kiến thức và kinh nghiệm về VBA, Google Appscript.
Ưu tiên có hiểu biết cơ bản về Quản trị nhân sự và Luật Lao động.
Kỹ năng lập kế hoạch, phân tích và tổng hợp dữ liệu.
- Phẩm chất
: Trách nhiệm, kiên nhẫn, cẩn thận; linh hoạt, thích nghi tốt và xử lý vấn đề hiệu quả.
-
Kinh nghiệm
: Tối thiểu 2 năm kinh nghiệm trong xây dựng báo cáo dữ liệu liên phòng ban, phân tích dữ liệu hoặc phát triển hệ thống quản lý thông minh.","- Môi trường làm việc quốc tế chuyên nghiệp, trẻ trung và năng động.
- Thu nhập cạnh tranh và được tham gia bảo hiểm xã hội theo đúng quy định.
- Chế độ thưởng các dịp Lễ (30/04 – 01/05, Quốc Khánh 02/09, Hiến chương các Nhà giáo 20/11 ...), Tết Dương lịch, Tết Âm lịch; chế độ thưởng KPIs hàng kỳ ...
- Chính sách ưu đãi học phí cho con với nhiều mức ưu đãi hấp dẫn.
- Chính sách đào tạo, phát triển năng lực để đáp ứng yêu cầu công việc và chuẩn bị cho lộ trình thăng tiến của CBNV.
- Chế độ ngày nghỉ hấp dẫn với chế độ NGHỈ HÈ, NGHỈ ĐÔNG đặc biệt của Công ty (bên cạnh thời gian nghỉ phép và nghỉ Lễ, Tết thông thường theo quy định).
- Chế độ du lịch và khám sức khỏe thường niên theo quy định của Công ty.
- Phụ cấp ăn trưa, thưởng chuyên cần.",https://edufitjobs.com/,1000+ nhân viên,Giáo dục / Đào tạo,"Tây Hồ Tây Starlake, Khu đô thị Tây Hồ Tây, Xuân Tảo, Tây Hồ, Hà Nội, Việt Nam","Edufit là tập đoàn tiên phong, mang đến nền giáo dục và sức khỏe đẳng cấp thế giới, được thành lập tại Việt Nam năm 2011. Với tầm nhìn trở thành biểu tượng của giáo dục và y tế Việt Nam, Edufit tập trung khẳng định quy mô, vị thế tiên phong trong lĩnh vực thông qua 4 hoạt động kinh doanh chủ lực: - Hoạt động giáo dục mầm non: Hệ thống Trường Mầm non Quốc tế Sakura Montessori. - Hoạt động giáo dục phổ thông bao gồm Tiểu học, Trung học cơ sở, Trung học phổ thông: Hệ thống Trường Phổ thông liên cấp Quốc tế The Dewey Schools - Hệ thống phòng khám tiêu chuẩn Nhật bản Mirai Healthcare - Dịch vụ hỗ trợ: Công ty cổ phần hợp tác giáo dục Việt Nam (Educo) Công ty Cổ phần S-Deli Công ty Cổ phần đào tạo ASC Tới điểm hiện tại, chúng tôi đã và đang xây dựng một đội ngũ vững mạnh các giáo viên, nhân viên, các nhà quản lý trong và ngoài nước có trình độ chuyên môn cao, giàu kinh nghiệm và nhiệt huyết, góp phần thực hiện một cách hiệu quả. Chúng tôi cung cấp chính sách lương và thù lao cạnh tranh, điều kiện làm việc tiện lợi, hỗ trợ từ ban lãnh đạo và cơ sở vật chất hiện đại. Hiện tại chúng tôi đang tìm kiếm những tài năng có mong muốn phát triển và thử thách bản thân ở các vị trí tiềm năng để cùng chúng tôi vươn xa hơn nữa. Hãy apply và cùng chúng tôi khám phá những cơ hội phát triển sự nghiệp của bạn nhé. Xem thêm Thu gọn"
Junior FP&A Analyst - Hồ Chí Minh,,https://www.topcv.vn/brand/beeogisticscorporation/tuyen-dung/junior-fpa-analyst-ho-chi-minh-j1851113.html?ta_source=JobSearchList_LinkDetail&u_sr_id=6oOcfChhJDdb5S1Ecdgd4AGKjb5PyMwrgRoWbeLA_1772869465,Bee Logistics Corporation,Bee Logistics Corporation - Chuyên trang tuyển dụng,https://www.topcv.vn/brand/beeogisticscorporation?id=2450,,12 - 20 triệu,,Hồ Chí Minh (mới),,2 năm,,27/03/2026,Chuyên môn Data Analyst; Tài chính; Kế toán,,,,,,,,,,,,,,
Nhân Viên Phân Tích Dữ Liệu (Kinh Doanh) - Kcq,Nhân Viên Phân Tích Dữ Liệu ( Kinh Doanh ) - Kcq,https://www.topcv.vn/viec-lam/nhan-vien-phan-tich-du-lieu-kinh-doanh-kcq/1680288.html?ta_source=JobSearchList_LinkDetail&u_sr_id=6oOcfChhJDdb5S1Ecdgd4AGKjb5PyMwrgRoWbeLA_1772869465,TỔNG CÔNG TY CỔ PHẦN BƯU CHÍNH VIETTEL,TỔNG CÔNG TY CỔ PHẦN BƯU CHÍNH VIETTEL,https://www.topcv.vn/cong-ty/tong-cong-ty-co-phan-buu-chinh-viettel/198966.html,https://www.topcv.vn/cong-ty/tong-cong-ty-co-phan-buu-chinh-viettel/198966.html,12 - 17 triệu,12 - 17 triệu,Hà Nội,Hà Nội,Không yêu cầu,Không yêu cầu,27/03/2026,Chuyên môn Logistics khác; Logistic / Vận tải; Xuất nhập khẩu / Hải quan; Bưu chính,Nhân viên,Đại Học trở lên,1 người,Toàn thời gian,"- Hà Nội: Tòa Viettel Post, số 2 ngõ 15 Duy Tân, Phường Cầu Giấy (quận Cầu Giấy cũ)",Thứ 2 - Thứ 6 (từ 08:00 đến 17:30); Làm việc 2 sáng thứ 7 của tháng (tuần thứ nhất và tuần thứ ba trong tháng),"Chuẩn hóa dữ liệu đầu vào các loại báo cáo (phát hiện các lỗi dữ liệu, loại bỏ ngoại lai…)
Xây dựng và cập nhật các loại danh mục khi có sự thay đổi.
Xây dựng dashboard theo dõi các chỉ tiêu kinh doanh và phân tích khách hàng định kì theo ngày/tháng/năm.
Phân tích số liệu kinh doanh phục vụ cho việc đánh giá và ra quyết định các dự án khác.
Các nhiệm vụ khác theo yêu cầu của Quản lý trực tiếp","Tốt nghiệp ĐH trở lên, ưu tiên chuyên ngành: Quản trị nhân lực, Tài chính kế toán,….
Có kiến thức về ít nhất một loại công cụ trực quan hóa dữ liệu (Tableau, Power BI, Google data studio…), ưu tiên có kinh nghiệm DAX Power BI
Thành thạo Excel, có kiến thức về VBA là một điểm cộng
Có tư duy logic, phản biện, khả năng phân tích và tìm insight từ kết quả phân tích
Có tinh thần tự học hỏi cao và khả năng làm việc độc lập tốt.","Tại Tổng Công ty cổ phần Bưu chính Viettel, các ứng viên sẽ được làm việc trong môi trường năng động, trẻ trung và chuyên nghiệp, với các đãi ngộ hấp dẫn sau:
1. Chế độ về lương thưởng, thu nhập:
Mức lương từ
12 - 20 Triệu/tháng
thỏa thuận theo năng lực và kinh nghiệm.
Có chế độ hỗ trợ tiền điện thoại và ăn trưa, nghỉ mát hàng năm; kèm theo là các khoản thưởng vào các dịp lễ lớn (30/4, 1/5, 2/9, ngày thành lập Tập đoàn, Tổng Công ty, Tết Dương/ Âm
2. Chương trình chăm sóc sức khỏe
Được đóng đầy đủ về các chế độ bảo hiểm xã hội, bảo hiểm y tế, bảo hiểm thất nghiệp và các gói bảo hiểm sức khỏe khác.
Hàng năm CBNV được tham gia khám sức khỏe định kỳ tại các bệnh viện lớn.
Phụ nữ có con nhỏ dưới 1 tuổi sẽ được nghỉ thêm 1h/ngày
3. Đào tạo, phát triển
Được tham gia các khóa học bổ ích từ các diễn giả Quốc tế tại Học viện Viettel, các khóa học do Tập đoàn/Tổng Công ty tổ chức & xây dựng.
Có cơ hội thăng tiến trong nghề nghiệp.
4. Hoạt động tập thể hấp dẫn, phong phú
Tham gia vào hoạt động 'Happy Time"" vào chiều thứ 6 hàng tuần cùng với chương trình sinh nhật tháng.
Chương trình teambuilding, văn hóa, du lịch nghỉ mát hấp dẫn và đa dạng.
Các hoạt động thể dục thể thao cùng các giải đấu được Tập đoàn tổ chức.",https://viettelpost.com.vn/,5000+ nhân viên,IT - Phần mềm,"Tòa ViettelPost, Số 2, Ngõ 15, Duy Tân, Dịch Vọng Hậu, Cầu Giấy, Hà Nội","TỔNG CÔNG TY CỔ PHẦN BƯU CHÍNH VIETTEL Là đơn vị thành viên của Tập đoàn Công nghiệp Viễn Thông Quân Đội Viettel Cơ cấu tổ chức của Viettel Post có 10 phòng ban, 04 Trung tâm, 05 công ty thành viên và 63 chi nhánh trên toàn quốc với gần 40.000 cán bộ công nhân viên. Xem thêm Thu gọn"
Data Analyst,,https://www.topcv.vn/brand/sapovn/tuyen-dung/data-analyst-j2042140.html?ta_source=JobSearchList_LinkDetail&u_sr_id=6oOcfChhJDdb5S1Ecdgd4AGKjb5PyMwrgRoWbeLA_1772869465,Công ty cổ phần Công nghệ Sapo,Công ty cổ phần Công nghệ Sapo - Chuyên trang tuyển dụng,https://www.topcv.vn/brand/sapovn?id=11698,,Thoả thuận,,Hà Nội,,3 năm,,27/03/2026,Chuyên môn Data Analyst; IT - Phần mềm; Thương mại điện tử; Bán lẻ - Hàng tiêu dùng - FMCG,,,,,,,,,,,,,,
Data Analyst - Domain Finance / Nhà Máy,Data Analyst - Domain Finance / Nhà Máy,https://www.topcv.vn/viec-lam/data-analyst-domain-finance-nha-may/2020536.html?ta_source=JobSearchList_LinkDetail&u_sr_id=6oOcfChhJDdb5S1Ecdgd4AGKjb5PyMwrgRoWbeLA_1772869465,Công ty TNHH Giải pháp Phân tích dữ liệu Insight Data,Công ty TNHH Giải pháp Phân tích dữ liệu Insight Data,https://www.topcv.vn/cong-ty/cong-ty-tnhh-giai-phap-phan-tich-du-lieu-insight-data/110386.html,https://www.topcv.vn/cong-ty/cong-ty-tnhh-giai-phap-phan-tich-du-lieu-insight-data/110386.html,Thoả thuận,Thoả thuận,Hà Nội,Hà Nội,3 năm,3 năm,31/03/2026,Data Analyst; IT - Phần mềm; Tài chính; Sản xuất,Trưởng nhóm,Đại Học trở lên,3 người,Toàn thời gian,"- Hà Nội: Vũ Văn Huyên, Phường Tây Hồ (quận Tây Hồ cũ)",Thứ 2 - Thứ 6 (từ 08:30 đến 17:30),"Tham gia phân tích dữ liệu, xây dựng mô hình dữ liệu (data model) trên các tập dữ liệu lớn trong môi trường doanh nghiệp.
Thu thập, làm rõ và phân tích yêu cầu nghiệp vụ từ các phòng ban/khách hàng (đặc biệt trong giai đoạn UAT & get requirements).
Thiết kế, phát triển và vận hành các báo cáo, dashboard phục vụ quản lý và ra quyết định bằng Power BI.
Thực hiện ETL, xử lý và chuẩn hóa dữ liệu từ nhiều nguồn (ERP, CRM, hệ thống nghiệp vụ…).
Làm việc với Data Warehouse (DWH), đảm bảo dữ liệu chính xác, nhất quán và tối ưu hiệu năng truy vấn.","Từ 2,5 năm kinh nghiệm thực tế với vai trò Data Analyst / Data Modeling trong môi trường dữ liệu lớn.
Có kinh nghiệm domain Finance hoặc Manufacturing (nhà máy)
Có kinh nghiệm với: Power BI (Data model, DAX, Dashboard, Reporting); SQL (query,   tối ưu truy vấn)
Có kinh nghiệm làm việc với ETL & Data Warehouse, ưu tiên đã từng sử dụng: SAP BW hoặc các hệ thống DWH tương đương.","Lương tháng 13
Hỗ trợ đầy đủ trang thiết bị làm việc PC/ Laptop….
Đóng bảo hiểm theo luật lao động Việt Nam (BHXH, BHYT, BHTN)
12 ngày phép/ năm và Thưởng vào các dịp lễ khác trong năm (1/1, 30/4-1/5; 2/9, 8/3, 20/10...), Sinh nhật; Chi phí công đoàn thăm hỏi vào các dịp hiếu, hỉ, ốm đau;
Làm việc thứ 2 đến thứ 6 (2 sáng thứ 7 tùy theo lịch khách hàng)
Phụ cấp gửi xe; Phụ cấp cơm trưa, ngoài ra phụ cấp điện thoại và đi lại tùy thuộc vào một số vị trí và cấp bậc;
Khám sức khỏe định kỳ 1 lần/năm
Du lịch nghỉ mát 1 lần/ năm.
Tổ chức teambuilding định kỳ, tổ chức sinh nhật, team lunch, …
Happy hours hàng tháng, free snacks, hoa quả, đồ uống.
Được đào tạo và trau dồi không chỉ kiến thức chuyên môn, kỹ năng mềm mà cả kỹ năng quản lý nhóm, quản lý dự án thông qua các buổi đào tạo nội bộ chung do phòng Đào tạo tổ chức hoặc các buổi đào tạo của riêng phòng ban;
Môi trường làm việc chuyên nghiệp, trẻ trung, năng động, nhiều cơ hội thăng tiến
Đội ngũ kỹ sư, nhân viên tài năng, giàu kinh nghiệm
Làm việc với tác đối tác lớn
Review tăng lương định kỳ hàng năm",https://inda.vn/,25-99 nhân viên,IT - Phần mềm,"19-21 Vũ Trọng Phụng, Thanh xuân, Hà Nội","Công ty TNHH Giải pháp và phân tích dữ liệu Insight Data (website: inda.vn), là một trong những doanh nghiệp hàng đầu trong lĩnh vực Công nghệ thông tin, đi tiên phong trong việc cung cấp các giải pháp chuyển đổi số cho doanh nghiệp. Insight Data hoạt động trong nhiều lĩnh vực: Cung cấp giải pháp tích hợp cho hệ thống CNTT; Cung cấp dịch vụ triển khai kho dữ liệu; Dịch vụ outsourcing - cho thuê nhân sự ngành Data, cung cấp bản quyền phần mềm chính hãng và Dịch vụ đào tạo toàn diện phù hợp với mọi phòng ban trong doanh nghiệp,... Được đánh giá là một trong những công ty hàng đầu trong lĩnh vực tích hợp giải pháp CNTT quy mô lớn, Insight Data đang trên đà phát triển vươn lên tầm khu vực lẫn toàn thế giới. Mang trong mình nhiều tiềm lực cũng như khả năng bắt kịp xu thế nhanh chóng và mạnh mẽ, Insight Data đã và đang cùng với đối tác triển khai nhiều dự án quan trọng của các ngân hàng lớn như VPBank, Seabank, Techcombank, Sacombank, WorldBank, .... Insight Data là đối tác tin cậy của nhiều tập đoàn hàng đầu thế giới như Masan, Đạm Phú Mỹ, Novaland, Mutosi, PTI,..... Xem thêm Thu gọn"
Chuyên Viên Phân Tích Dữ Liệu (Data Analyst),,https://www.topcv.vn/brand/sofitel/tuyen-dung/chuyen-vien-phan-tich-du-lieu-data-analyst-j948277.html?ta_source=JobSearchList_LinkDetail&u_sr_id=6oOcfChhJDdb5S1Ecdgd4AGKjb5PyMwrgRoWbeLA_1772869465,CÔNG TY TNHH CÁC GIẢI PHÁP SOFTEL,CÔNG TY TNHH CÁC GIẢI PHÁP SOFTEL - Chuyên trang tuyển dụng,https://www.topcv.vn/brand/sofitel?id=87554,,20 - 39 triệu,,Hà Nội,,3 năm,,12/03/2026,Chuyên môn Data Analyst,,,,,,,,,,,,,,
Senior Data Analyst,Senior Data Analyst,https://www.topcv.vn/viec-lam/senior-data-analyst/1961030.html?ta_source=JobSearchList_LinkDetail&u_sr_id=6oOcfChhJDdb5S1Ecdgd4AGKjb5PyMwrgRoWbeLA_1772869465,CÔNG TY TNHH TRUYỀN HÌNH FPT,CÔNG TY TNHH TRUYỀN HÌNH FPT,https://www.topcv.vn/cong-ty/cong-ty-tnhh-truyen-hinh-fpt/105865.html,https://www.topcv.vn/cong-ty/cong-ty-tnhh-truyen-hinh-fpt/105865.html,Thoả thuận,Thoả thuận,Hồ Chí Minh (mới),Hồ Chí Minh,3 năm,3 năm,31/03/2026,Data Analyst; Phát thanh / Truyền hình,Trưởng nhóm,Đại Học trở lên,1 người,Toàn thời gian,"- Hồ Chí Minh: Tòa nhà FPT, lô L29B-31B-33B, Đường Tân Thuận, KCX Tân Thuận, Phường Tân Thuận (Quận 7 cũ)",Thứ 2 - Thứ 6 (từ 08:00 đến 17:30),"Thu thập, xử lý và làm sạch dữ liệu từ nhiều nguồn khác nhau.
Phân tích dữ liệu, phát hiện các xu hướng và mẫu hành vi nhằm hỗ trợ giải quyết bài toán kinh doanh
Diễn giải kết quả phân tích để đề xuất các giải pháp chiến lược hoặc cải tiến quy trình vận hành
Xây dựng báo cáo, dashboard hỗ trợ các phòng ban trong việc đưa ra quyết định chính xác và kịp thời.","Tốt nghiệp Đại học Công nghệ thông tin/ Khoa học máy tính/Hệ thống thông tin quản lý/ Viễn thông.
Tối thiểu 03 năm kinh nghiệm trong lĩnh vực phân tích dữ liệu hoặc vị trí tương đương
Sử dụng thành thạo một trong các ngôn ngữ lập trình R hoặc Python
Hiểu biết vững vàng về thống kê, khai phá dữ liệu (data mining)
Có kinh nghiệm làm việc với ngôn ngữ truy vấn SQL
Thành thạo các công cụ ETL/ELT và BI Tools (Power BI, Tableau, v.v.)
Có kiến thức cơ bản hoặc kinh nghiệm liên quan đến Machine Learning là một lợi thế
Tư duy logic và phản biện tốt
Kỹ năng giao tiếp và trình bày thông tin rõ ràng, dễ hiểu cho cả đối tượng không chuyên môn
Tinh thần học hỏi, chủ động trong công việc","Thu nhập cạnh tranh, bao gồm lương tháng 13, thưởng và các chế độ phúc lợi khác.
Làm việc trong môi trường năng động, chuyên nghiệp với nhiều cơ hội thăng tiến.
Được trang bị đầy đủ công cụ, thiết bị làm việc.
Tham gia các hoạt động văn hóa doanh nghiệp đa dạng: Teambuilding, Ngày hội văn hóa, Câu lạc bộ nội bộ...
Hưởng đầy đủ chế độ phúc lợi theo Luật Lao động (BHXH, BHYT, BHTN, ngày phép năm), khám sức khỏe định kỳ, nghỉ mát hàng năm và gói bảo hiểm sức khỏe chuyên biệt FPT Care.
Được tham gia các khóa đào tạo nâng cao nghiệp vụ thường xuyên.
Hưởng các gói ưu đãi cước khi sử dụng dịch vụ của FPT Play.",https://fptplay.vn,100-499 nhân viên,Marketing / Truyền thông / Quảng cáo,Hồ Chí Minh,"CÔNG TY TNHH TRUYỀN HÌNH FPT - FPT Televison Tiên phong ứng dụng công nghệ trí tuệ nhân tạo, công nghệ hình ảnh 4K và âm thanh Dolby Atmos sống động, FPT Play mở ra kỷ nguyên giải trí không giới hạn, cá nhân hóa hành trình trải nghiệm đầy cảm xúc cho khán giả, mọi lúc, mọi nơi. Thương hiệu hợp nhất đến từ Truyền hình FPT và FPT Play Không giới hạn nền tảng Không giới hạn nội dung Không giới hạn thưởng thức Không giới hạn thời gian xem FPT Play mong muốn sẽ phát triển một hệ sinh thái nội dung thịnh vượng song hành mang đến giá trị, quyền lợi tối ưu cho khách hàng và các đối tác. Xem thêm Thu gọn"
Thực Tập Sinh Phân Tích Đầu Tư,Thực Tập Sinh Phân Tích Đầu Tư,https://www.topcv.vn/viec-lam/thuc-tap-sinh-phan-tich-dau-tu/1865273.html?ta_source=JobSearchList_LinkDetail&u_sr_id=6oOcfChhJDdb5S1Ecdgd4AGKjb5PyMwrgRoWbeLA_1772869465,CÔNG TY TNHH ĐẦU TƯ VÀ PHÁT TRIỂN FINTOP,CÔNG TY TNHH ĐẦU TƯ VÀ PHÁT TRIỂN FINTOP,https://www.topcv.vn/cong-ty/cong-ty-tnhh-dau-tu-va-phat-trien-fintop/202190.html,https://www.topcv.vn/cong-ty/cong-ty-tnhh-dau-tu-va-phat-trien-fintop/202190.html,2 - 3 triệu,2 - 3 triệu,Hà Nội & Hồ Chí Minh (mới),"Hà Nội , Hồ Chí Minh",Không yêu cầu,Không yêu cầu,26/03/2026,Phân tích dữ liệu,Thực tập sinh,Đại Học trở lên,10 người,Thực tập,"- Hà Nội: Số 8 Phạm Ngọc Thạch (Toà MB Bank0, Phường Kim Liên (quận Đống Đa cũ); - Hồ Chí Minh: Leman Luxury - 117 Nguyễn Đình Chiểu, Phường Xuân Hòa (Quận 3 cũ)",Thứ 2 - Thứ 6 (từ 08:30 đến 11:30); Thứ 2 - Thứ 6 (từ 13:00 đến 17:00),"Phân tích đầu tư là vị trí trọng yếu, quan trọng bậc nhất của Phòng Đầu Tư, là CoreTeam/Trưởng nhóm nghiên cứu, phân tích chuyên sâu trong ứng dụng đầu tư thực chiến; Là nhân sự “Cán bộ nguồn” định hướng trở thành Cán bộ quản lý (Team Leader).
Phân tích đầu tư:
Nghiên cứu và phân tích Thị trường chứng khoán (TTCK), các yếu tố vĩ mô, ngành và các thị trường đầu tư liên quan để đề ra chiến lược đầu tư hiệu quả trong ngắn – trung – dài hạn. Nghiên cứu & phân tích các Doanh nghiệp, Ngành đầu tư (TA, FA), chọn lọc cổ phiếu và tìm kiếm các cơ hội đầu tư. Nghiên cứu xây dựng các Danh mục đầu tư – “Hệ thống giao dịch” hiệu quả, phân tích đánh giá QTRR đầu tư. Tham gia công tác tổ chức, hoạt động chuyên môn, hội thảo, báo cáo nghiên cứu và phân tích đầu tư.
Phát triển Team/Nhóm đầu tư:
+ Phát triển Nhóm: Tìm kiếm các cơ hội hợp tác đầu tư, phát triển các Đối tác đầu tư; mở rộng phát triển thành viên Nhóm đầu tư (nhà đầu tư) tham gia vào Hệ thống giao dịch đầu tư của Team;                                                                                                               + Phát triển Team: Tuyển dụng, hợp tác, hướng dẫn, đào tạo, phát triển TVĐT và CTV - các Trưởng nhóm KH; cùng Team xây dựng, mở rộng và phát triển Hệ thống.
Phát triển Kênh Phân tích đầu tư: Xây dựng và phát triển Kênh PTĐT cá nhân hoặc Kênh PTĐT team 2-3 người và/hoặc tham gia làm nội dung Kênh Phân tích FINTOP, tạo ra giá trị cho cộng đồng, thu hút nhà đầu tư quan tâm, hợp tác, tham gia SP/DV, Hệ thống giao dịch đầu tư.
Họp & Đào tạo: Tham gia họp và đào tạo với Lãnh đạo và Cán bộ quản lý, nắm bắt thông tin để đào tạo, hướng dẫn triển khai cho Team. Tham gia đào tạo, củng cố, phát triển năng lực chuyên môn nghiên cứu, phân tích, quản lý và phát triển Hệ thống đầu tư.","Yêu thích và đam mê đầu tư, định hướng theo đuổi lâu dài phát triển trong lĩnh vực đầu tư;
Cần có kinh nghiệm tham gia đầu tư thực chiến, nghiên cứu và tìm hiểu các doanh nghiệp đầu tư; Có danh mục hoặc phương pháp đầu tư có lãi là một lợi thế;
Chủ động, năng động, sáng tạo, cầu thị phát triển; Có chí tiến thủ, học hỏi phát triển đi lên;
Có khả năng giao tiếp truyền đạt tốt, teamwork đội nhóm, chuyên nghiệp trong công việc;
Có khả năng phân tích, trình bày, tư duy logic, đàm phán, thuyết phục, kỹ năng văn phòng.
Trình độ đại học; có nền tảng kiến thức, hiểu biết về Kinh tế, Tài chính sẽ có lợi thế.","Được đào tạo và phát triển lên vị trí chuyên nghiệp - Chuyên viên Phân tích đầu tư, cơ hội thăng tiến với vị trí Quản lý - Trưởng Phòng Đầu tư;
Thu nhập cao: Thu nhập từ hoạt động đầu tư, % HH Hệ thống giao dịch, % Phí Quản lý;
Cơ hội hợp tác/làm việc với các công ty chứng khoán hàng đầu Việt Nam (VPS, TCBS); thăng tiến, phát triển nghề nghiệp với các vị trí Cố vấn, Chuyên gia.
Thu nhập Chuyên viên 20-30tr, Chuyên viên Senior 40-60tr, Trưởng Phòng Đầu tư (>100tr)
Cơ hội làm việc, hợp tác và phát triển với các Chuyên gia (Master) đầu ngành, các Nhà đầu tư lớn (Cá mập), xây dựng một Net-work giá trị trong cuộc sống và trong công việc..",https://fintopdata.vn/,25-99 nhân viên,Chứng khoán,"Số 65 Ô Chợ Dừa, Phường Ô Chợ Dừa, Quận Đống Đa, Thành phố Hà Nội","FINTOP là doanh nghiệp Fintech hoạt động, định hướng, phát triển trong lĩnh vực Công nghệ Tài chính, Nghiên cứu - Phân tích - Xử lý - Xuất bản Dữ liệu đầu tư với các “Mô hình tiên tiến” (Model) chuẩn hóa cho hiệu quả cao, ứng dụng “Công nghệ AI” trong phân tích, nghiên cứu cùng Đội ngũ Chuyên gia giàu kinh nghiệm nhằm mang đến những công cụ và dữ liệu bổ trợ mạnh mẽ cho hoạt động phân tích và ra quyết định đầu tư. FINTOP không ngừng mở rộng, hợp tác phát triển, cung cấp các sản phẩm/dịch vụ trọng yếu, đa dạng trong lĩnh vực Tài chính & Đầu tư. Xem thêm Thu gọn"
