title,detail_title,job_url,company,company_name_full,company_url,company_url_from_job,salary_list,detail_salary,address_list,detail_location,exp_list,detail_experience,deadline,tags,job_level,education_level,job_quantity,employment_type,working_addresses,working_times,desc_mota,desc_yeucau,desc_quyenloi,company_website,company_scale,company_field,company_address,company_description
Trưởng Nhóm Phân Tích Kinh Doanh,Trưởng Nhóm Phân Tích Kinh Doanh,https://www.topcv.vn/viec-lam/truong-nhom-phan-tich-kinh-doanh/2017347.html?ta_source=JobSearchList_LinkDetail&u_sr_id=6oOcfChhJDdb5S1Ecdgd4AGKjb5PyMwrgRoWbeLA_1772869020,Tập Đoàn Vàng Bạc Đá Quý DOJI,Tập Đoàn Vàng Bạc Đá Quý DOJI,https://www.topcv.vn/cong-ty/tap-doan-vang-bac-da-quy-doji/198942.html,https://www.topcv.vn/cong-ty/tap-doan-vang-bac-da-quy-doji/198942.html,30 - 35 triệu,30 - 35 triệu,Hà Nội,Hà Nội,5 năm,5 năm,29/03/2026,Phân tích dữ liệu; Bán lẻ - Hàng tiêu dùng - FMCG; Tài chính,Trưởng nhóm,Đại Học trở lên,2 người,Toàn thời gian,"- Hà Nội: số 5 Lê Duẩn, Phường Ba Đình (quận Ba Đình cũ)",,"- Lập báo cáo doanh số hàng ngày / hàng tuần của các Trung tâm / Chi nhánh
- Tương tác với GĐ Chi Nhánh và các bộ phận khác để đưa ra cảnh báo / phân tích kinh doanh
- Thu thập thông tin đối thủ cạnh tranh
-  Nghiên cứu, phân tích các diễn biến của thị trường đối với hoạt động kinh doanh và đề xuất giải pháp.
- Xây dựng và đề xuất chương trình khuyến mại
- Phân tích các số liệu, các chương trình kinh doanh để so sánh, tìm ra các vấn đề, giải pháp.
- Đánh giá hiệu quả các hoạt động kinh doanh chung theo từng tháng, quý, năm
- Thực hiện các nhiệm vụ khác theo sự phân công của Giám đốc Trung tâm.","- Trình độ: Tốt nghiệp Đại học (chuyên ngành: kinh tế, tài chính, quản trị kinh doanh, kế hoạch đầu tư...);
- Kinh nghiệm: Có tối thiểu 5 năm kinh nghiệm làm việc liên tục trong lĩnh vực Kế hoạch/Phân tích
- Ưu tiên các ứng viên có kinh nghiệm làm việc ở các vị trí Phân tích, Kế hoạch kinh doanh ở các doanh nghiệp mô hình bán lẻ, bán buôn,...","1/Mức lương: 30 - 35 triệu
Lương thỏa thuận theo năng lực và kinh nghiệm thực tế của ứng viên và các loại phụ cấp theo yêu cầu công việc...;
Lương tháng 13 bằng từ 1-5 tháng lương thỏa thuận.
2/Thưởng:
Thưởng định kỳ theo kết quả kinh doanh chung của Tập đoàn theo quý và theo năm;
Thưởng đột xuất theo chương trình chung của Tập đoàn;
Thưởng đột xuất theo thành tích đặc biệt và hoặc các sáng kiến cải tiến trong công việc.
3/Chế độ đãi ngộ khác:
Được hưởng đầy đủ các chế độ phúc lợi cơ bản theo quy định của nhà nước ngay sau kết thúc thời gian thử việc bao gồm BHXH, BHYT, BHTN, chế độ Khám sức khỏe định kỳ...;
Được hưởng đầy đủ các chế độ phúc lợi động viên cho bản thân và người thân theo quy định chung của Tập đoàn như Chế độ thăm hỏi; Mừng các ngày lễ trong năm; Mừng ngày thành lập Tập đoàn; Hiếu - hỉ...;
Được hưởng đầy đủ các chế độ phúc lợi nâng cao (dành cho cấp quản lý) như: Mừng danh hiệu quản lý cuối năm, Bảo hiểm sức khỏe cho bản thân và người thân; Chăm sóc sức khỏe (tập thể thao, tập gym...); Hỗ trợ đi lại; Hỗ trợ mua sắm và sử dụng dịch vụ ưu đãi;
Được tham gia các hoạt động ngoại khóa, văn hóa đoàn thể hấp dẫn dành cho CBNV;
Môi trường làm việc chuyên nghiệp, nhân văn, văn hóa và thân thiện
4/Thời gian làm việc:
Từ 8h30 - 17h30, nghỉ trưa từ 12h - 13h, ăn trưa tại Căng tin tập đoàn. Thứ 7 làm việc cách tuần.",http://doji.vn/,1000+ nhân viên,Bán lẻ - Hàng tiêu dùng - FMCG,Tòa nhà DOJI Tower - Số 5 đường Lê Duẩn - Ba Đình - Hà Nội,"Tập đoàn Vàng Bạc Đá Quý DOJI là Tập đoàn tư nhân 9 năm liên tiếp đạt top 5 doanh nghiệp Tư nhân lớn nhất Việt Nam, 8 năm liên tiếp được công nhận là thương hiệu quốc gia Việt Nam với bề dày 25 năm và quy mô trên 3000 nhân viên trong toàn hệ thống. Là Tập đoàn lớn nhất trên thị trường kinh doanh Vàng và Trang sức hiện nay, DOJI trải dài khắp 3 miền, có mặt tại các tỉnh thành lớn trong cả nước, đang tiếp tục khẳng định tên tuổi trên thị trường thế giới với kì tích đưa loại đá Ruby Sao Việt Nam trở nên nổi tiếng, được mệnh danh là “Ông Hoàng Ruby Sao” DOJI nắm trong tay quyền điều hành các Doanh nghiệp đang lớn mạnh như: Ngân hàng Tiên phong (Tienphongbank), Công ty Vàng bạc Đá quý SJC HN, SJC Đà Nẵng, cùng nhiều chi nhánh, công ty thành viên, công ty góp vốn khác trải dài trên nhiều lĩnh vực: từ các hoạt động Khai thác mỏ, Chế tác cắt mài Đá quý, Sản xuất hàng Trang sức, Kinh doanh vàng miếng, Hệ thống chuỗi Trung tâm Trang sức cao cấp, hệ thống Nhà hàng cao cấp, đầu tư và kinh doanh Bất động sản. Tập đoàn DOJI đã tạo một dấu ấn mạnh mẽ trong cộng đồng doanh nghiệp Việt Nam nói chung và trong lĩnh vực Vàng bạc Đá quý nói riêng với tốc độ tăng trưởng doanh thu ấn tượng và giá trị thương hiệu ngày càng lớn mạnh. Chiếm lĩnh thị trường nội địa với hệ thống kinh doanh Vàng miếng, phân phối Kim cương và Trang sức cao cấp khắp ba miền Bắc - Trung - Nam, thương hiệu DOJI đang bước đi vững chãi trong lộ trình chinh phục khách hàng bằng uy tín và chất lượng sản phẩm. Luôn chú trọng đầu tư thiết bị, nghiên cứu ứng dụng công nghệ sản xuất hiện đại, chiến lược Marketing bài bản, Tập đoàn DOJI thể hiện nhiều lợi thế cạnh tranh so với các sản phẩm cùng phân khúc và khẳng định vị thế tiên phong trong lĩnh vực bản lề là Vàng bạc Đá quý và Trang sức. Bắt đầu tham gia vào lĩnh vực Bất động sản, Công ty thành viên DOJILAND đã ghi dấu ấn với những dự án tại Quảng Ninh, Vĩnh Phúc nên đã tạo lập được uy tín trên thị trường, tiếp tục khẳng định sự thành công ở lĩnh vực hoạt động then chốt của DOJI trong chặng đường phát triển tiếp theo. Với tầm nhìn chiến lược, quan điểm phát triển bền vững, tiềm lực hùng mạnh, Tập đoàn DOJI khẳng định đẳng cấp thương hiệu quốc gia Việt Nam, sẵn sàng tâm thế hội nhập và vươn xa trong khu vực cũng như quốc tế trong tương lai. Xem thêm Thu gọn"
Business Data Analyst,Business Data Analyst,https://www.topcv.vn/viec-lam/business-data-analyst/2048784.html?ta_source=JobSearchList_LinkDetail&u_sr_id=6oOcfChhJDdb5S1Ecdgd4AGKjb5PyMwrgRoWbeLA_1772869020,CÔNG TY CỔ PHẦN CÔNG NGHỆ ALPHAWAY,CÔNG TY CỔ PHẦN CÔNG NGHỆ ALPHAWAY,https://www.topcv.vn/cong-ty/cong-ty-co-phan-cong-nghe-alphaway/201267.html,https://www.topcv.vn/cong-ty/cong-ty-co-phan-cong-nghe-alphaway/201267.html,20 - 50 triệu,20 - 50 triệu,Hà Nội,Hà Nội,3 năm,3 năm,29/03/2026,Business Analyst (Phân tích nghiệp vụ),Trưởng nhóm,Cao Đẳng trở lên,3 người,Toàn thời gian,"- Hà Nội: 06 Quang Trung, Phường Hai Bà Trưng (quận Hai Bà Trưng cũ); - Hà Nội: 119 Trần Duy Hưng, Phường Yên Hòa (quận Cầu Giấy cũ); - Hà Nội: 127 Lò Đúc, Phường Hai Bà Trưng (quận Hai Bà Trưng cũ)",Thứ 2 - Thứ 6 (từ 09:00 đến 18:30),"Gather and analyze business requirements related to banking data.
Analyze data from banking systems (Core Banking, Payment, Card, CRM, Digital Banking).
Build and maintain management reports and KPI dashboards.Provide data insights to support business decisions, product optimization, and operational efficiency.
Define business metrics, KPI logic, and data definitions.
Work closely with Business, IT, Data Engineer, and Product teams to ensure data accuracy and consistency.","BA Experience & Skills:
o Experience as a Software BA
o Excellent at Communication & Negotiation in environment with multiple stakeholders
o Excellent at Presentation (Diagrams, Matrix ...) & Documentation for Business & Technical audiences (in both English and Vietnamese);
o Excellent in Requirement Elicitation & Specification
Data Knowledge & Skills:
o Excellent level on SQL extract data on DB
o Experience on Enterprise DB Server: SQL, Oracle, IBM DB2...
o Good understanding about Cloud technology (AWS technical stack: Glue, Athena,  S3...) & knowledge for Data brick is plus point.
o Strong knowledge & proven experience about Data platform such as Data warehouse  (Dimensional Modelling, ETL, Staging, DataMart, SCD, CDC...)
Bank Domain Knowledge & Experience:
o Understanding about Bank general knowledge: Products, Channels, Systems...
o Really good understanding about Bank data from System point of view (applied for  Senior)
o Experience on Bank projects is big plus.
Others:
o English: Excellent level – can communicate smoothly with foreign parties (applied for  Officer/Senior)
o Proven experience on Integration project (handling on Data Mapping, Data  Modelling…)
o Proven experience on international projects with stakeholders from various countries  (applied for Senior)","Salary up to 50,000,000 VND.
13th-month salary and company standard benefits.
Team building activities and annual health check-ups.
Social, health, and unemployment insurance in accordance with Vietnamese labor law.
Unlimited career growth and promotion opportunities.
Opportunity to work with experienced PMs and Tech Leads in banking and insurance domains.",https://alphawaytech.com/introduction/,500-1000 nhân viên,IT - Phần mềm,"Tầng 4, tòa 21T1 Hapulico, số 83 Vũ Trọng Phụng, Thanh Xuân, Hà Nội","ALPHAWAY TECHNOLOGY là nhà cung cấp các giải pháp và dịch vụ công nghệ thông tin toàn diện cho các tổ chức cá nhân trên toàn quốc, có kinh nghiệm chuyên sâu trong lĩnh vực này. Thành lập năm 2018 với sứ mệnh mang lại giải pháp công nghệ giá trị và trải nghiệm vượt trội cho người dùng toàn cầu, Alphaway Technology đã và đang không ngừng phát triển, mở rộng hoạt động kinh doanh, đạt mục tiêu trở thành thương hiệu nằm trong top 100 công ty công nghệ giá trị hàng đầu Việt Nam. Xem thêm Thu gọn"
Chuyên Gia Quản Trị Vận Hành,Chuyên Gia Quản Trị Vận Hành,https://www.topcv.vn/viec-lam/chuyen-gia-quan-tri-van-hanh/2047671.html?ta_source=JobSearchList_LinkDetail&u_sr_id=6oOcfChhJDdb5S1Ecdgd4AGKjb5PyMwrgRoWbeLA_1772869020,Ngân hàng TMCP Quốc Dân,Ngân hàng TMCP Quốc Dân,https://www.topcv.vn/cong-ty/ngan-hang-tmcp-quoc-dan/198920.html,https://www.topcv.vn/cong-ty/ngan-hang-tmcp-quoc-dan/198920.html,Thoả thuận,Thoả thuận,Hà Nội,Hà Nội,Trên 5 năm,Trên 5 năm,29/03/2026,Data Analyst; Ngân hàng; Tài chính; Kế toán; Kiểm toán; Công nghệ kỹ thuật,Trưởng/Phó phòng,Đại Học trở lên,1 người,Toàn thời gian,"- Hà Nội: 28 Bà Triệu, Phường Cửa Nam (quận Hoàn Kiếm cũ)",,"Thu thập, phân tích dữ liệu, đo lường các chỉ tiêu thể hiện hiệu suất làm việc như KPIs, TAT...
Thực hiện vận hành và xây dựng hệ thống cơ sở dữ liệu và báo cáo cho hoạt động đo lường kết quả và đánh giá hiệu quả làm việc
Nghiên cứu các phương pháp mới và áp dụng công nghệ trong việc thực thi đo lường để đảm bảo tính chính xác và nhanh chóng
Chủ trì công tác phân tích, đề xuất và báo cáo liên quan đến các hoạt động quản lý hiệu suất công việc của khối
Cung cấp báo cáo, tư vấn cho các bộ phận liên quan thực hiện số hóa, cải tiến quy trình nhằm tối ưu vận hành
Xây dựng, tư vấn và hỗ trợ các đơn vị trong Khối xây dựng ngân sách
Theo dõi, đánh giá kết quả sử dụng ngân sách của các đơn vị trong khối
Tổng hợp, phân tích và báo cáo các cấp lãnh đạo về kết quả sử dụng ngân sách, đề xuất các phương án để tối ưu ngân sách
Đào tạo, chia sẻ kinh nghiệm, kiến thức, kỹ năng và hỗ trợ các thành viên trong quá trình làm việc
Các công việc khác theo sự phân công của lãnh đạo","Trình độ: Đại học, chuyên ngành: Kinh tế, tài chính, ngân hàng, quản trị kinh doanh, kế toán, kiểm toán, công nghệ thông tin
Có ít nhất 6 năm kinh nhiệm trong lĩnh vực ngân hàng, trong đó ít nhất 03 năm kinh nghiệm làm quản trị vận hành/quản trị hiệu suất vận hành; hoặc ít nhất 08 năm kinh nghiệm làm lĩnh vực phân tích dữ liệu trong đó có ít nhất 03 năm phân tích dữ liệu hiệu suất vận hành/kinh doanh ngân hàng
Hiểu biết sâu sắc về các chỉ số đo lường hiệu quả làm việc (KPIs, SLAs, TAT...)
Hiểu biết và làm chủ về các công cụ làm báo cáo quản trị (excel, SQL, PBI...)
Am hiểu về các công nghệ, và có khả năng ứng dụng các giải pháp mới bao gồm nhưng không giới hạn (AI, BlockChain, IOT, BigData...)
Có tư duy logic và có khả năng làm việc tốt với số liệu
Có hiểu biết sâu sắc về các phần mềm tính toán, phân tích số liệu
Trung thực, thận trọng, khách quan trong thực hiện công việc
Yêu cầu bảo mật cao về thông tin
Có kĩ năng giao tiếp tốt; đàm phán, thuyết phục tốt, có kỹ năng giải quyết vấn đề
Có khả năng nắm bắt công việc nhanh, quản lý, sắp xếp, xử lý công việc khoa học
Có kinh nghiệm quản lý nhóm
Có khả năng thu thập, xử lý và tổng hợp thông tin
Có khả năng làm việc độc lập và làm việc theo nhóm
Có kỹ năng lập kế hoạch; tổ chức công vệc","Chế độ bảo hiểm
Du Lịch
Đồng phục
Chế độ thưởng
Chăm sóc sức khỏe
Đào tạo
Tăng lương
Nghỉ phép năm",https://tuyendungncb.iviec.vn/vi,1000+ nhân viên,Tư vấn,"25 Lê Đại Hành, Phường Lê Đại Hành, Quận Hai Ba Trưng, Hà Nội","Ngân hàng TMCP Quốc Dân – NCB được thành lập từ năm 1995 theo Giấy phép số 00057/NH–CP ngày 18/09/1995 của Ngân hàng Nhà nước Việt Nam dưới tên gọi Ngân hàng Sông Kiên. Sau đó, từ một ngân hàng nông thôn, NCB đã chuyển đổi quy mô thành ngân hàng đô thị, đổi tên thành Ngân hàng TMCP Nam Việt– Navibank. Đến năm 2014, NCB chính thức được đổi tên thành NH TMCP Quốc Dân – NCB. Trải qua 22 năm hoạt động, NCB đã từng bước khẳng định được vị thế thương hiệu trên thị trường tài chính – tiền tệ Việt Nam. Từ đầu năm 2013, nhằm đáp ứng nhu cầu ngày càng tăng của thị trường và duy trì vị trí của mình trong môi trường cạnh tranh khốc liệt, Ngân hàng TMCP Quốc Dân đã bắt đầu tiến hành tái cấu trúc hệ thống với định hướng phấn đấu trở thành một trong các ngân hàng thương mại bán lẻ hiệu quả nhất. Để hoàn thành mục tiêu đó, NCB đã nỗ lực tập trung vào những yếu tố cốt lõi như: thay đổi cơ cấu tổ chức hướng đến việc tách bạch giữa các khối kinh doanh với các khối quản trị và hỗ trợ, cải tiến các quy định, quy trình, thay đổi cấu trúc kinh doanh, củng cố và nâng cao năng lực cán bộ nhân viên, tăng cường quản trị rủi ro,... Xem thêm Thu gọn"
Trưởng Nhóm Data Analyst – Tài Chính,Trưởng Nhóm Data Analyst – Tài Chính,https://www.topcv.vn/viec-lam/truong-nhom-data-analyst-tai-chinh/2047165.html?ta_source=JobSearchList_LinkDetail&u_sr_id=6oOcfChhJDdb5S1Ecdgd4AGKjb5PyMwrgRoWbeLA_1772869020,CÔNG TY CỔ PHẦN HỆ THỐNG Y TẾ SMEDICARE,CÔNG TY CỔ PHẦN HỆ THỐNG Y TẾ SMEDICARE,https://www.topcv.vn/cong-ty/cong-ty-co-phan-he-thong-y-te-smedicare/184826.html,https://www.topcv.vn/cong-ty/cong-ty-co-phan-he-thong-y-te-smedicare/184826.html,30 - 40 triệu,30 - 40 triệu,Hà Nội & Phú Thọ (mới),"Hà Nội , Phú Thọ",3 năm,3 năm,29/03/2026,Chuyên môn Tài chính,Trưởng nhóm,Đại Học trở lên,1 người,Toàn thời gian,"- Hà Nội: Số 58/61 Phạm Tuấn Tài, Phường Nghĩa Đô (quận Bắc Từ Liêm, quận Cầu Giấy cũ); - Phú Thọ: Số 122 Nguyễn Tất Thành, Phường Vĩnh Phúc (Thành phố Vĩnh Yên cũ)",Thứ 2 - Thứ 6 (từ 08:30 đến 17:30); Tháng nghỉ 2 thứ 7+ 4 chủ nhật,"- Chủ trì xây dựng và chuẩn hóa hệ thống master data (danh mục dịch vụ, danh mục chi phí, mã khoa phòng…) làm nền tảng cho phân tích tài chính và quản trị vận hành toàn viện.
- Định hướng và phối hợp xây dựng Data Warehouse, thiết kế và kiểm soát luồng dữ liệu (data flow) giữa các hệ thống: HIS, CRM, KCB, Tài chính – Kế toán… đảm bảo tính chính xác, đồng nhất và minh bạch số liệu.
- Phát triển và quản lý hệ thống Báo cáo quản trị & BI (Power BI, Data Studio…) phục vụ Ban Giám đốc: báo cáo doanh thu, chi phí, lợi nhuận, cơ cấu dịch vụ, hiệu suất khoa phòng.
- Đảm bảo kết nối và đồng bộ dữ liệu liên phòng ban, kiểm soát tính đầy đủ – hợp lệ của dữ liệu tài chính, hỗ trợ chốt số và phân tích kinh doanh định kỳ.
- Phân tích hiệu quả hoạt động (KPI), biên lợi nhuận theo dịch vụ/khoa phòng; đưa ra các khuyến nghị tối ưu chi phí, cải thiện doanh thu và nâng cao hiệu quả vận hành.
- Dẫn dắt đội ngũ Data/BA, thúc đẩy tự động hóa hệ thống báo cáo, chuyển đổi từ mô hình thủ công sang hệ thống báo cáo realtime/auto, phục vụ quản trị dựa trên dữ liệu (data-driven management).","- Tốt nghiệp Đại học chuyên ngành: Tài chính, Kế toán, Kiểm toán, Phân tích dữ liệu hoặc các ngành liên quan.
- Kinh nghiệm tối thiểu 3–5 năm ở vị trí Trưởng nhóm/Chuyên viên cao cấp Tài chính  hoặc Data Analyst  (ưu tiên trong lĩnh vực bệnh viện, y tế, FMCG, vận hành).
- Có kinh nghiệm làm việc với dữ liệu: Power BI, Excel nâng cao, SQL là lợi thế lớn.
- Hiểu biết về hệ thống HIS/CRM hoặc các phần mềm vận hành bệnh viện là điểm cộng.
- Tư duy logic, phân tích tốt; chủ động, cẩn trọng, cam kết cao với deadline.
- Kỹ năng giao tiếp và phối hợp liên phòng ban tốt.","- Thu nhập hấp dẫn: 30 – 40 triệu/tháng (thỏa thuận theo năng lực)
- Thưởng theo hiệu quả công việc và kết quả kinh doanh
- Được tham gia trực tiếp vào các quyết định chiến lược về tài chính – vận hành, làm việc cùng Ban Giám đốc trong các dự án chuyển đổi số và tối ưu quản trị
- Cơ hội xây dựng và dẫn dắt hệ thống Data & BI bài bản từ nền tảng, tạo dấu ấn cá nhân ở cấp quản lý
- Môi trường chuyên nghiệp, định hướng quản trị dựa trên dữ liệu (data-driven), khuyến khích đổi mới và cải tiến
- Được xây dựng và phát triển đội ngũ riêng, nâng cao năng lực quản lý và tư duy chiến lược
- Tham gia BHXH đầy đủ theo quy định
- Chế độ phúc lợi, nghỉ lễ, thưởng theo quy định của công ty",,100-499 nhân viên,Dược phẩm / Y tế / Công nghệ sinh học,"Số nhà 12 Đặng Trần Côn, Phường Quốc Tử Giám, Quận Đống Đa, Thành phố Hà Nội, Việt Nam","Hệ thống Y tế Smedicare là nơi hội tụ của những giá trị y tế hàng đầu, được xây dựng trên nền tảng phát triển vững chắc từ các cơ sở y tế chất lượng như bệnh viện và phòng khám. Được thành lập với sứ mệnh nâng tầm chăm sóc sức khỏe cộng đồng, Smedicare không chỉ tập trung vào việc cung cấp dịch vụ y tế xuất sắc mà còn đặt mục tiêu phát triển các dự án y tế tiên phong, chuyên nghiệp và tận tâm. Hiện tại, Smedicare sở hữu và điều hành Bệnh viện Quốc tế Vĩnh Phúc, một cơ sở y tế hiện đại, và Phòng khám đa khoa Nam Long, nơi đang trong quá trình nâng cấp để trở thành một bệnh viện tiên tiến. Đồng thời, Smedicare đang triển khai một dự án đầy hứa hẹn về chuỗi phòng khám da liễu - spa và cơ xương khớp, nhằm mang đến những giải pháp chăm sóc sức khỏe toàn diện và hiệu quả. Điểm đặc biệt của Smedicare nằm ở đội ngũ nhân sự tài năng, được tuyển chọn kỹ lưỡng từ các môi trường y tế chuyên nghiệp hàng đầu như Bạch Mai, Vinmec, Hồng Ngọc, Thu Cúc, cùng với sự góp mặt của những chuyên gia giàu kinh nghiệm từ các môi trường startup và công nghệ đột phá như Topica và Onemount ,Vingroup. Tại Smedicare, chúng tôi không chỉ xây dựng một môi trường làm việc chuyên nghiệp và tận tâm, mà còn là nơi nuôi dưỡng và phát triển tài năng, đem lại cơ hội thăng tiến và sáng tạo không giới hạn cho những người đam mê lĩnh vực y tế. Hãy cùng Smedicare tiên phong trong hành trình nâng tầm chất lượng cuộc sống và sức khỏe cộng đồng. Xem thêm Thu gọn"
